id,text,date,source,author,score,type
t3_1or11vt,Do people understand the purpose of privacy coins?,2025-11-07T17:45:48,r/cryptocurrency,002_timmy,243,post
t1_nnmsb86,I fear that they don’t even understand things like encryption and taxes,2025-11-07T17:53:43,r/cryptocurrency,BoobindarPussia_,28,comment
t1_nnmxeac,I wish I could do that if my Monero didn't sink with my boat,2025-11-07T18:18:39,r/cryptocurrency,stKKd,17,comment
t1_nnms4kh,Why do people record themselves committing crimes?,2025-11-07T17:52:49,r/cryptocurrency,light_death-note,12,comment
t1_nnmrqig,do you ? because people not knowing how much you hold at any given point is only a very tiny part.,2025-11-07T17:50:54,r/cryptocurrency,kane49,12,comment
t1_nnsyvgb,"They didn't buy it for privacy, they bought it because the price was ripping.",2025-11-08T18:27:14,r/cryptocurrency,Django_McFly,4,comment
t3_1oieq8q,"Satoshi, We Have A Problem: At 17 Years Old, Banks Love Bitcoin This Friday marks seventeen years since Satoshi Nakamoto published a vision for digital money that required no financial intermediaries.

Today, that revolution seems to have come full circle: Wall Street now holds the keys.

From BlackRock’s Bitcoin ETFs to JPMorgan’s decision to accept Bitcoin and Ether as collateral, the very institutions Bitcoin was meant to bypass have become its custodians, its biggest beneficiaries and champions... and perhaps its greatest test.

I’ve always wondered how Bitcoin was *actually* supposed to work according to Satoshi, and I’m sure I am not alone in this

So I asked Bitget’s GetAgent: *“Satoshi, was Bitcoin really meant to be a store of value or a currency for everyday use?”*

What do you think Satoshi will say about this?",2025-10-28T16:52:30,r/cryptocurrency,Green_Candler,239,post
t1_nluz6vr,[deleted],2025-10-28T17:14:28,r/cryptocurrency,[deleted],51,comment
t1_nlxfpv0,"Satoshi created it to be a p2p, decentralized currency. Not digital gold that would be in control of the very system it was created to fight against. It started out promising but its failed in its mission. I truly believe Monero is the last and only true crypto that can succeed where Bitcoin flopped.",2025-10-29T00:46:46,r/cryptocurrency,Super_flywhiteguy,51,comment
t1_nlvtk60,"No matter how much Bitcoin they buy, you can still use it without needing an intermediary. That property doesn't go away.",2025-10-28T19:42:04,r/cryptocurrency,GaussAF,47,comment
t1_nlv03j9,I bet whoever invented fiat believed that it would be the perfect decentralized way to eliminate abuses that stemmed from the subjectivity of the barter system.,2025-10-28T17:18:45,r/cryptocurrency,exploringspace_,25,comment
t1_nluw7fl,"tldr; Seventeen years after Satoshi Nakamoto introduced Bitcoin as a decentralized alternative to traditional financial systems, major banks and institutions like BlackRock and JPMorgan have embraced it, ironically becoming its custodians. This shift highlights the evolution of revolutions, where resistance leads to absorption and transformation. While Bitcoin's institutional adoption marks progress, its core promise of self-custody and user sovereignty remains a cultural battle. The future of Bitcoin depends on societal choices and values shaping the next era of money and freedom.

*This summary is auto generated by a bot and not meant to replace reading the original article. As always, DYOR.",2025-10-28T17:00:17,r/cryptocurrency,coinfeeds-bot,18,comment
t3_1o96jpf,"BTC may record its first negative October since 2018, with sentiment among retail traders on social media turning increasingly cautious",2025-10-17T16:49:00,r/cryptocurrency,Next_Statement6145,236,post
t1_nk02q8z,It's the 17th...,2025-10-17T17:02:47,r/cryptocurrency,Elec7roniX,109,comment
t1_nk01pwu,"You could have presented a similar negative post on Sep 24 2025, but the month ended in green.

Until the month is not OVER, you can’t rule the VERDICT! 

Thank you for your attention to this. DFT",2025-10-17T16:57:47,r/cryptocurrency,A3333Z,76,comment
t1_nk08f1c,LOL random chart is random. Got nothing to do with October and everything to do with the rotten orange in the oval office.,2025-10-17T17:30:53,r/cryptocurrency,MrFiskIt,40,comment
t1_nk0gkls,"Unless the Greedy take this on a bull run I am  calling it, the crypto market collapses.",2025-10-17T18:11:38,r/cryptocurrency,Mac_McAvery,13,comment
t1_nk023bz,I'm tired of Cointelegraph tweets on Reddit.,2025-10-17T16:59:37,r/cryptocurrency,MichaelAischmann,12,comment
t3_1o7lamb,Elon Musk Hails Bitcoin As Energy-Based Alternative to 'Fake' Fiat Currencies,2025-10-15T19:53:11,r/cryptocurrency,sadiq_238,234,post
t1_njoghmc,Market is so fed up with his nonsense there is not even a slight movement following this,2025-10-15T20:02:05,r/cryptocurrency,Exceptionaltomato,88,comment
t1_njoglh7,It would be great if he can stop being an attention whore,2025-10-15T20:02:37,r/cryptocurrency,Bear-Bull-Pig,71,comment
t1_njohjcv,Is he willing to give away his fake fiat?,2025-10-15T20:07:19,r/cryptocurrency,Ok-Fruit-2252,29,comment
t1_njoh0qt,enough of these billionaires giving takes on crypto everyday,2025-10-15T20:04:44,r/cryptocurrency,Next_Statement6145,10,comment
t1_njogc0v,"He not only faked (IMHO) all of his ""green save the world"" PR, but now is actively promoting perhaps the largest waste of electricity in the entire world! 

BTC is not ""energy based"" in that it doesn't store the energy and you can't get the energy back out of it.......we already have a currency that does that without requiring massive waste of energy

(like most every currency that exists!).",2025-10-15T20:01:18,r/cryptocurrency,RosieDear,10,comment
t3_1ov903g,Morgan Stanley says it’s harvest time as Bitcoin enters ‘fall’ season,2025-11-12T15:59:05,r/cryptocurrency,DryMyBottom,237,post
t1_noh63i0,"These are all the same people that just a few years ago said it was worthless or would be worthless, then they got on board, and now they claim to be experts and know what’s going to happen. Like all stocks and markets, at the end of the day nobody knows, But it’s very very likely that bitcoin is here to stay and will only continue to appreciate.",2025-11-12T16:16:23,r/cryptocurrency,StellaNova79,107,comment
t1_noh2tvy,"tldr; Morgan Stanley strategists suggest that Bitcoin has entered the 'fall season' of its four-year cycle, a period historically associated with harvesting gains before a potential downturn or 'crypto winter.' They recommend investors consider taking profits during this phase. Despite Bitcoin's recent dip below its 365-day moving average, which some analysts view as a bearish signal, institutional interest in Bitcoin as a digital asset and hedge against inflation continues to grow, supported by ETFs and regulatory advancements.

*This summary is auto generated by a bot and not meant to replace reading the original article. As always, DYOR.",2025-11-12T16:00:24,r/cryptocurrency,coinfeeds-bot,19,comment
t1_noi7s5j,See you guys again in 2029!,2025-11-12T19:18:56,r/cryptocurrency,BGM1988,12,comment
t1_noh6naa,"Talk about ""burying the lede""...(An old newspaper term for presenting the result before presenting the situation in general)...

This post starts by talking about analysts advising, I GUESS...RETAIL INVESTORS , to take profits based on possible dips. It goes on to say that the ""stagnation""(?) of capital inflows vs outflows, is relevant...it is not, it is a constant in commerce and investing. 

The article ends by admitting that Institutional Investors are not or cannot do any of this because of the nature of being a large investor. Admitting that they have rules in place as to making knee jerk decisions. The point being that responsible investment strategies are anchored in being deliberative and ""long"" in their business model/ investment strategies. 

Smh. 

They could have led with that. Back to work. LOL. ..it is your money, do your research. Know why you invested and build a common sense approach to accepting unverified advice. 

HODL",2025-11-12T16:19:03,r/cryptocurrency,Advanced-Summer1572,12,comment
t1_nohlayo,https://i.redd.it/7hgy00bw2v0g1.gif,2025-11-12T17:30:40,r/cryptocurrency,Cheewhoo,3,comment
t3_1osly5h,"Ethereum Faces Critical Scaling Issue, Vitalik Admits Mistake Ethereum has been highly reliant on the Zero Knowledge Solutions like ZK Rollups. It had even bought blobs, temporary storage spaces in Ethereum L1 blocks, to reduce the cost that rollups pay to finalize their transactions on Ethereum

Further, Ethereum had also bought the Dencun Upgrade on March 13, 2024 and the Pectra Upgrade on May 7, 2025 to help rollups.

However, a past legacy solution remains a critical bottleneck for Ethereum Scaling called the “modexp precompile”.

ModeXP Precompile is an algorithm that enables the execution of highly complex operations, which other protocols, such as RSA, cannot perform.

When ModeXP was created around 2017, there were no Zero Knowledge Protocols. In the current scenario, they force the Zero Knowledge Rollup to simulate the Ethereum blockchain for every transaction in a particular summary.",2025-11-09T15:19:49,r/cryptocurrency,emperordas,237,post
t1_no1zkkk,"Simplified explanation for the inept:

Imagine you have a busy highway (Ethereum network + its scaling layers) and you want lots of cars (transactions) to pass through quickly, cheaply. You also have some new super-fast lanes (layer 2s + ZK-rollups) to help relieve congestion. Great.

But then there’s a single toll booth (the modexp precompile) that’s super slow whenever certain kinds of cars use it. It doesn’t stop all cars, only some kinds of cars (those requiring that particular crypto operation). But because these kinds of operations are common in some of the new scaling / ZK stuff, the slow booth backs up traffic, slows everything down, and raises costs.

So even though you’ve built the super-fast lanes, the toll booth still forces many cars into a jam or makes them pay a lot more. That means your overall highway throughput (transactions per second), or cost per car (gas/fees), gets worse than potential. And the new lanes don’t work as well or as cheaply as they could.",2025-11-10T04:22:31,r/cryptocurrency,puckmugger,132,comment
t1_nnxwpe2,"tldr; Ethereum is facing a critical scaling issue due to the 'modexp precompile,' an encryption algorithm created by Vitalik Buterin in 2017. This algorithm significantly slows down Zero Knowledge (ZK) rollups, which are essential for Ethereum's scalability. Vitalik admitted the algorithm was a mistake and proposed an Ethereum Improvement Proposal (EIP) to replace it with a more ZK-friendly solution. The current algorithm increases execution difficulty by up to 50 times, potentially causing consensus failures and negating the benefits of recent upgrades like Dencun and Pectra.

*This summary is auto generated by a bot and not meant to replace reading the original article. As always, DYOR.",2025-11-09T15:20:22,r/cryptocurrency,coinfeeds-bot,64,comment
t1_nnz5qs5,First time ever I heard that a software developer made a mistake,2025-11-09T18:57:54,r/cryptocurrency,nachtraum,57,comment
t1_nnxxo89,Not possible to prove the locking condition was satisfied if the unlocking parameters have been deleted. Consensus failure,2025-11-09T15:25:25,r/cryptocurrency,pop-1988,40,comment
t1_no03xbp,So can it be fixed without people having to migrate to different wallets etc? Eg I don’t need to do anything?,2025-11-09T21:43:30,r/cryptocurrency,richsonreddit,20,comment
t3_1onuab1,literally me (i'm down bad),2025-11-04T01:21:53,r/cryptocurrency,Environmental_gobrrr,236,post
t1_nmzfeyq,"50% dip right after you buy. Wife leaves, mansion ends up under the bridge, and steak becomes ramen…",2025-11-04T01:24:35,r/cryptocurrency,GreedVault,19,comment
t1_nmzs6mp,"That's called FOMO. Buy the ones that have not pumped yet. 

If Dash and Zec have pumped, think outside the box and go for something else.",2025-11-04T02:39:07,r/cryptocurrency,winphan,7,comment
t1_nmzt8tg,You are only down if you sell!!,2025-11-04T02:45:14,r/cryptocurrency,jhorskey26,5,comment
t1_nmzfzwi,"I'm ballin'. 

Wanted to buy a bunch of LINK a couple of days ago but figured we were about to get a dump to Bitcoin's 50 week MA. 

105k is close enough for me so I pulled the trigger at $15.4 / LINK. Let's see how this plays out.

Also wouldn't surprise me if LINK hits $13 tomorrow, honestly - if Bitcoin does hit / go under 102k. But I'm banking on one last push upwards by the market, so hopefully the $2 don't matter.",2025-11-04T01:28:02,r/cryptocurrency,schizophrenicbugs,2,comment
t1_nn0h9it,"spx6900 fixes this

https://i.redd.it/beogkhwve6zf1.gif

Stop trading and believe in something",2025-11-04T05:29:12,r/cryptocurrency,Project_Demosthenes_,1,comment
t3_1ojv1zx,"Is VeChain (VET) dead? I bought VET back in the height of 2021 at £0.11 per coin. Today we’re sitting at £0.012 per coin, so I’ve lost majority of my investment.

I’m wondering is this worth me bringing my average down or is this coin dead in the water?

Last year when BTC rallied, VET went from £0.01 to £0.06, which if the same thing happened, I’d recoup most of my investment. However I hardly see any backing or following behind VET anymore.

Would appreciate some views - and yes I appreciate this isn’t financially wise, and obviously risk losing more money, but I can drastically bring my average down right now with only a small amount of money.",2025-10-30T09:28:53,r/cryptocurrency,JonBoiIsItNow,231,post
t1_nm5vsg1,I never met a person that did anything on VeChain,2025-10-30T09:37:55,r/cryptocurrency,ReadersAreRedditors,231,comment
t1_nm5x24y,"Like a lot of alts it's bit of a train wreck, struggling to find any economic reason to exist. What's more it seems to have a  whole bunch of bagholders. Any significant price pump will have to overcome this pressure on the sell side.",2025-10-30T09:49:53,r/cryptocurrency,TheBattleDan,177,comment
t1_nm5x7pe,"You can find this post in my profile too, reposting it because apparently cross linking subreddits is a nightmare here.   
  
Almost every indicator I look for a healthy project is present with Vechain.  
Just to name a few.

\- Active, frequent community engagement on twitter(spaces), including Sunny who drops in sometimes. Anyone can ask questions as long as you keep it civil.  
\- Clear roadmap at the start of the year, keeping every deadline and delivering.  
\- You can tell from their github activity that they clearly increased the amount of developer working on the project.  
\- Vebetter DAO with ever increasing dApps. These dApps mostly using AI to fact check and there are many bad actors and there are dApps which let you earn actual money from just picking up your dog poop(which you should be doing anyway) and get rewards for it.  
There was a post where a user thanked the developers because this paid for their dog treatment.  
You can earn money from drying your cloths on the sun and not using a dryer. Taking photos of your reusable mug. There is many more what you may find fun but overall and what matters for many is money. Casually(!!) using the app can get you $$$ monthly, yes you saw that right.  
\- Veword wallet login for dApps that made by vechain. Kinda like how facebook, gmail login works but for dApps which streamlines and takes the pain out of login.  
\- DEX with liquidity that allows moderate swaps between coins.  
\- Credit card that supports B3TR(afaik its called Stella pay). Less step to spend your crypto.  
\- Credit card(s) that support VET/ VTHO. Revolute and more credit card will start support this chain after the 2025 Q4 Hayabusa update.  
\- Vechain going full decentralized by end of this year!!! Anyone can become a validator without KYC.  
\- Mentioned before, metamask support and every goodies that comes with having proper multichain DEX support. Metamask got a credit card too I believe.  
2020 finally said hi to Vechain, better late than never.

These are just the things I remember without thinking much about it.

Price wise vechain doing dogshit and I'm not too worried about it.  
It will be bad when every coin goes up but vechain a.k.a not rising with the tide. This never happened so far.  
It will be bad if vechain is only rising with the tide and not gaining momentum. This never happened either.  
Whenever the bull market for alt started, Vechain was pulling ahead of others.

Last bullrun Vechain went even lower than now. Bloodbath is a gentle word to describe how bad it was YET vechain ended up being top 15 on CMC after a crazy run.

Not saying this is going to happen again, just saying its too early to worry about the price action.",2025-10-30T09:51:20,r/cryptocurrency,JuniorPosition9631,61,comment
t1_nm5zl14,"they put some ads on the UFC octagon, if I remember correctly.",2025-10-30T10:12:47,r/cryptocurrency,monchimer,59,comment
t1_nm6c28c,"I would agree generally VET (and frankly most alts out the top 15) are virtually dead. 

That being said all this intense bearish sentiment makes me feel like it could get a face ripping melt up that surprises everyone if alt season comes. Crypto will always do the opposite of what the masses expect",2025-10-30T11:50:02,r/cryptocurrency,proto_ant,48,comment
t3_1o9c35t,Halloween Just Round The Corner,2025-10-17T20:21:32,r/cryptocurrency,TheGreatCryptopo,228,post
t1_nk16ugp,No fu*king way Cramer is that self-aware,2025-10-17T20:27:25,r/cryptocurrency,Wise-Grapefruit-1443,5,comment
t1_nk1d5u5,does jim cramer inverse himself?,2025-10-17T21:00:25,r/cryptocurrency,Next_Statement6145,5,comment
t1_nk1bnqr,"Maybe the newer crypto enthusiasts don't know this: Jim Cramer featured in the first televised Bitcoin reference. He played a witness in CBS's lawyer drama The Good Wife. Season 3 Episode 13 titled ""Bitcoin for Dummies"" aired January 2012 & made Bitcoin history.",2025-10-17T20:52:33,r/cryptocurrency,MichaelAischmann,2,comment
t1_nk9nl58,Jim crater,2025-10-19T06:33:32,r/cryptocurrency,nasnedigonyat,2,comment
t1_nk18y19,"Jim Cramer bullish + Trump doing Trump things.

See ya all at $10k then...",2025-10-17T20:38:20,r/cryptocurrency,partymsl,1,comment
t3_1o78gkw,"Economist Peter Schiff says Bitcoin’s failure to rise with gold means the party is over. Economist and gold advocate Peter Schiff shared his view following gold’s surge above $4,200, arguing that Bitcoin’s lack of movement alongside gold signals weakness rather than delayed strength.

“Bitcoiners are convinced that gold's historic rise means Bitcoin will not only follow gold's lead, but soon surpass its performance. However, it’s more likely that Bitcoin's failure to rise with gold means the party is over. Instead of a catch-up boom, expect a belated bust.”
— Peter Schiff on X

Schiff suggests that instead of Bitcoin benefiting from gold’s momentum, it may face a “belated bust” as investors turn toward traditional safe-haven assets.",2025-10-15T11:31:22,r/cryptocurrency,According_Time5120,230,post
t1_njlsxb2,Pack it up gentlemen. It appears the jig is up.,2025-10-15T11:42:10,r/cryptocurrency,frozenarmy25,214,comment
t1_njls0t7,Seems like we have found a local bottom.,2025-10-15T11:35:31,r/cryptocurrency,Donnie_DarkoCx,128,comment
t1_njlshwu,Peter’s been calling Bitcoin’s funeral since it was $50 at this point the only thing ‘belated’ is his realization he’s been wrong for over a decade,2025-10-15T11:39:03,r/cryptocurrency,BoobindarPussia_,110,comment
t1_njluigm,15k to 120k is a failure to rise? Ok grandpa time to get you in bed,2025-10-15T11:53:20,r/cryptocurrency,Ok_Fig705,86,comment
t1_njls0my,"He’s correct about what btc is. A speculative asset that tracks the Nasdaq 100 at a high beta, not a flight to safety. If the past few weeks haven’t convinced you of this then I don’t know what will. 

He’s flat out wrong on his price predictions though. 

Bitcoin isn’t going anywhere.",2025-10-15T11:35:29,r/cryptocurrency,Misher7,32,comment
t3_1omns6d,"Bitcoin is the culmination of 40 years of thinking about cryptography, decentralization, power and energy * Tweet: [https://x.com/BTC\_Archive/status/1985010276127678845](https://x.com/BTC_Archive/status/1985010276127678845)
* Image creator: [https://x.com/danheld](https://x.com/danheld)",2025-11-02T17:46:20,r/cryptocurrency,kirtash93,228,post
t1_nmqpxlo,"Uh no. Research continued afterwards and gave birth to more secure, less wasteful and more capable blockchains (Ethereum was the first of them).

Then ZK-STARKS was invented to make L2s as secure as their L1 blockchains while being 100x faster.

Bitcoin was just a draft of technology and would be completely ignored if it were released nowadays. It is now nothing else than the biggest memecoin",2025-11-02T18:11:04,r/cryptocurrency,trillionSdollarstech,27,comment
t1_nmqnept,But can it run Crysis?,2025-11-02T17:58:43,r/cryptocurrency,TheRealCRex,15,comment
t1_nms2ps7,"Bitcoin is to crypto, what AOL was to the internet. 

The internet wouldn’t be what it is now without AoL. But AoL is obsolete. Btc will be too. It’s too costly, slow, and resistant to fundamental change.",2025-11-02T22:04:31,r/cryptocurrency,adamlh,13,comment
t1_nmresht,Sorry but Bitcoin is pretty shit in today's cryptographic standards.,2025-11-02T20:08:58,r/cryptocurrency,AssistTraditional480,12,comment
t1_nmqobj5,It’s kinda shit when it comes to energy consumption lol,2025-11-02T18:03:14,r/cryptocurrency,Slartibartfast342,9,comment
t3_1ooy33b,Panic Hits Crypto: OG Whales Dump $41B in Bitcoin — Is $70K Next?,2025-11-05T09:07:50,r/cryptocurrency,goldyluckinblokchain,222,post
t1_nn7k273,"If you're an OG Crypto Whale...you'll have lived through Bitcoin dumping because of big exchanges back in the day getting hacked, China ""banning"" Bitcoin every other week and every other thing that has caused sudden price crashes...yet all of a sudden, mass panic and sell off.  They might be selling off to buy in lower but there is no panic.",2025-11-05T09:15:32,r/cryptocurrency,Immediate_Banana_216,205,comment
t1_nn8f6ek,Cmon headline writer…’Panic! At the Crypto’ was right there!,2025-11-05T13:25:07,r/cryptocurrency,ElStegasaurus,57,comment
t1_nn7mll3,"Who cares , it will be up eventually.  
I just wish I had cash during those crazy sales.",2025-11-05T09:41:34,r/cryptocurrency,No_Dot_6270,44,comment
t1_nn89sk1,It's hilarious how BTC is trading over $100k and people are in panic.,2025-11-05T12:52:58,r/cryptocurrency,Mestyo,26,comment
t1_nn7ufr1,Would be a lovely sale,2025-11-05T10:56:33,r/cryptocurrency,rocket_beer,18,comment
t3_1om328b,Tether Reports $10 Billion Profit in 2025 So Far,2025-11-02T00:01:48,r/cryptocurrency,GreedVault,224,post
t1_nmmpfpj,How are they earning 9% on treasuries?,2025-11-02T01:18:01,r/cryptocurrency,Murky_Citron_1799,86,comment
t1_nmmekja,"USDT 🚀🚀🚀🚀

Wait",2025-11-02T00:15:04,r/cryptocurrency,Hakushakuu,74,comment
t1_nmmjj9o,No fucking way this isn’t a scam,2025-11-02T00:44:28,r/cryptocurrency,MechRxn,63,comment
t1_nmmvsre,Wen audit report?,2025-11-02T01:55:20,r/cryptocurrency,Dongerated,49,comment
t1_nmmczdj,"I mean, yeah. They're literally scammers who counterfeit money.",2025-11-02T00:05:40,r/cryptocurrency,oh_no_the_claw,38,comment
t3_1obfy37,Google says hackers are turning public blockchains into unkillable malware safehouses,2025-10-20T10:54:00,r/cryptocurrency,Embarrassed_Look9200,222,post
t1_nkgeo83,I don't get it. Sure they can store the code for their malware on the blockchain but does it really matter? How is the plain code supposed to infect users?,2025-10-20T11:21:15,r/cryptocurrency,B34chboy,96,comment
t1_nkgp977,"tldr; Google's Threat Intelligence Group reports that hackers, including North Korean state-sponsored groups, are exploiting public blockchains like Ethereum and BNB Smart Chain to embed and distribute malware. This technique, called EtherHiding, uses blockchain smart contracts to store malicious code, making it nearly impossible to disrupt due to the decentralized and immutable nature of blockchains. The approach combines social engineering with blockchain-based malware delivery, allowing attackers to evade detection and update payloads while minimizing costs and leaving no trace.

*This summary is auto generated by a bot and not meant to replace reading the original article. As always, DYOR.",2025-10-20T12:40:08,r/cryptocurrency,coinfeeds-bot,18,comment
t1_nkgdy6z,Mainly Worst Korea doing this,2025-10-20T11:15:01,r/cryptocurrency,CipherScarlatti,7,comment
t1_nkgu6qc,We'll have to reach out to the manager or these decentralised entities and get that sorted out!,2025-10-20T13:12:34,r/cryptocurrency,Madgick,3,comment
t1_nkko0yw,"ngl this one scares me a bit. From what I read, it seems that it is much easier to infect someone with malware using blockchain than any other technology",2025-10-21T09:28:37,r/cryptocurrency,jclaslie,2,comment
t3_1o7khev,Japan to Ban Crypto Insider Trading Under New Financial Rules,2025-10-15T19:21:50,r/cryptocurrency,Next_Statement6145,222,post
t1_njoa01v,this must sound foreign to the U.S,2025-10-15T19:29:37,r/cryptocurrency,Next_Statement6145,64,comment
t1_njoayut,Trump's family shaking. Then they read it's in Japan,2025-10-15T19:34:35,r/cryptocurrency,namieorange,15,comment
