id,text,date,source,author,score,type
t3_1o6p76d,I think my parents are still mad about buying BTC at 127K,2025-10-14T19:29:50,r/cryptocurrency,Odd-Radio-8500,12605,post
t1_nji1vq0,"Could be worse. They could have downgraded your account to ""Guest"".",2025-10-14T19:36:31,r/cryptocurrency,MentalBomb,1823,comment
t1_nji227o,That's why I keep this shit to myself.,2025-10-14T19:37:26,r/cryptocurrency,MichaelAischmann,867,comment
t1_nji48oi,You did that. Stop lying for clout. Your parents could care less about updating Netflix profile name lmaooo,2025-10-14T19:48:20,r/cryptocurrency,tracyhills21,674,comment
t1_nji34ck,“Mr Octover”,2025-10-14T19:42:45,r/cryptocurrency,Next_Statement6145,137,comment
t1_nji65lp,"In most cases when you tell someone to invest into Crypto, it will end up bad for you.",2025-10-14T19:57:52,r/cryptocurrency,CriticalCobraz,65,comment
t3_1oap0wg,Just keep going to the right,2025-10-19T12:59:18,r/cryptocurrency,CragBawz,7560,post
t1_nkavcvo,"if you buy more now, your entry gets averaged down to look less shit",2025-10-19T13:10:36,r/cryptocurrency,Happy-For-No-Reason,565,comment
t1_nkaw5x2,"Like the old gamblers prayer:  Dear Lord, please let me break even, I could really use the money.",2025-10-19T13:15:46,r/cryptocurrency,wBeeze,307,comment
t1_nkawmnd,“best i can do is -40%”,2025-10-19T13:18:41,r/cryptocurrency,Next_Statement6145,172,comment
t1_nkay0qj,You either die an alt hypeman or live long enough to become a bitcoin maxi,2025-10-19T13:27:25,r/cryptocurrency,DicksFried4Harambe,137,comment
t1_nkaxsru,"I‘m so tired of winning. Please Mr. President, make it stop.",2025-10-19T13:26:02,r/cryptocurrency,MichaelAischmann,103,comment
t3_1on9bvk,We are now at no.2,2025-11-03T11:32:06,r/cryptocurrency,Odd-Radio-8500,6992,post
t1_nmv3t5g,https://i.redd.it/gzsu2tll41zf1.gif,2025-11-03T11:42:36,r/cryptocurrency,OccasionalXerophile,1415,comment
t1_nmv4t7h,How many times have I seen this?,2025-11-03T11:50:39,r/cryptocurrency,Misher7,686,comment
t1_nmv3qqx,"The truth is: No one knows. Maybe the believers are right, maybe the non believers are right. We‘ll see in like 6 months when either side yells: „I toLd YoU sO“",2025-11-03T11:42:04,r/cryptocurrency,blu_marlin_,558,comment
t1_nmv374u,I think we are at stage 7... I knew I should have sold after stage 3.,2025-11-03T11:37:39,r/cryptocurrency,kipha01,143,comment
t1_nmvapjj,Crypto is just a money laundering scam for rich people now.,2025-11-03T12:33:50,r/cryptocurrency,FlopsMcDoogle,112,comment
t3_1o87u13,Did you even say thank you?,2025-10-16T14:35:29,r/cryptocurrency,Fritz1818,5306,post
t1_njswkcq,Any way I could be added to the groupchat?,2025-10-16T14:38:19,r/cryptocurrency,duspel-sol,411,comment
t1_njt7k48,The worst thing is that the victims of these scams are probably proud Trump made bank. Crazy.,2025-10-16T15:33:23,r/cryptocurrency,Klugenshmirtz,226,comment
t1_njt4xy9,"“crypto president”

for the benefit of the people right? 

right?",2025-10-16T15:20:19,r/cryptocurrency,Next_Statement6145,195,comment
t1_njszn3l,Grifters gonna grift.,2025-10-16T14:53:43,r/cryptocurrency,Raynsen,112,comment
t1_njt7zgw,[deleted],2025-10-16T15:35:31,r/cryptocurrency,[deleted],62,comment
t3_1olo7jz,Binance helped Trump crypto company make billions before president pardoned its boss,2025-11-01T13:45:16,r/cryptocurrency,Abdeliq,5012,post
t1_nmj7ns7,Im beginning to think this Trump guy might be a bit corrupt,2025-11-01T13:52:57,r/cryptocurrency,HGJustTheTip,889,comment
t1_nmj96px,One of the biggest scandals of this crime family administration. And virtually zero coverage by the media.,2025-11-01T14:01:59,r/cryptocurrency,Secret_Cat_2793,358,comment
t1_nmj7k0g,Yep. We live in a world where crime is legal and millions can buy your freedom,2025-11-01T13:52:18,r/cryptocurrency,RandoDude124,128,comment
t1_nmj8uij,Trump? Corrupt? No way... He's a billionaire- these people go to politics to help others.  /S,2025-11-01T13:59:59,r/cryptocurrency,Choice_Ad_9169,91,comment
t1_nmj90dp,To the surprise of ... NOBODY following what's happening,2025-11-01T14:00:56,r/cryptocurrency,owen__wilsons__nose,39,comment
t3_1of0jrt,Before the CZ pardon. Binance took up a sizeable portion in USD1 giving the Trump family ~$50M a year in yield farming on Treasury Bonds.,2025-10-24T15:18:41,r/cryptocurrency,GabeSter,4672,post
t1_nl5kaey,"Okay...so please...someone tell me if I'm understanding the implication correctly.

1. Binance secretly funnels $2B to WLFI.
2. WLFI then takes that money and buys $2B of treasury bonds and creates $2B of USD1.
3. The Treasury bonds begin earning interest to the tune of $60-80 million a year for WLFI.
4. This original $2B of USD1 is given to a shell company that 'invests' it back into Binance, which sits in Binance's bank account as USD1.
5. As long as Binance does not redeem the USD1 for cash, this will continue to earn money for WLFI.
6. Trump owns WLFI, so is getting $60-80 million a year for cash that was not his own.

Is that right?",2025-10-24T15:43:38,r/cryptocurrency,howmanyones,770,comment
t1_nl5gavf,"To the surprise of no one.

What really blows my mind is not the level of corruption. It’s the fact that no one is doing a damn thing to end this. It’s like this is the new norm and that’s ok.",2025-10-24T15:24:20,r/cryptocurrency,En4cr,445,comment
t1_nl5iefl,The word for this is bribery. Some will call it a kickback. Trump will say he knows nothing of it.,2025-10-24T15:34:31,r/cryptocurrency,Livid_Yam,334,comment
t1_nl5hsj7,did anyone really believed that the Trump family wasn't this greedy and corrupt?,2025-10-24T15:31:33,r/cryptocurrency,DryMyBottom,94,comment
t1_nl5q29q,U guys asked how the people of russia accept putin? Got ya bitch,2025-10-24T16:11:36,r/cryptocurrency,Comfortable_Alps2618,62,comment
t3_1oe6s9b,U.S. President Donald Trump Pardons Binance Founder CZ,2025-10-23T15:45:55,r/cryptocurrency,meeleen223,4577,post
t1_nkzt1e3,"I would not be surprised if the payment for this pardon was the liquidation event that happened on the Binance network following Trump’s tweet Oct 10th, which coincidentally was front run by a crypto wallet that pocketed over $100 million immediately. While I fundamentally believe in crypto, I also feel that it is awash in corruption. Its lack of oversight makes it perfect for the Trump organization.",2025-10-23T17:44:33,r/cryptocurrency,CanadianGenerationX,167,comment
t1_nkzzeu4,"The USA will never recover from this.

The people who conspired to place Trump where he is did a good job destroying this nation.

No telling what the future holds.

Fucking MAGA idiots. 

Your our nation’s Nazis and you can bet your ass this nation and its sane citizens who can rub two braincells together will deal with MAGA in a similar fashion to what awaited the shitbag Nazis after their circlejerk was over.

Morons. Wear that shame for the rest of your lives.",2025-10-23T18:15:10,r/cryptocurrency,CryptoNerdSmacker,160,comment
t1_nkz991q,"Earlier this year:
The United Arab Emirates' state-owned investment fund MGX, which is chaired by Abu Dhabi's deputy ruler, invested $US2 billion in the crypto exchange Binance.

This investment was made using one of World Liberty Financial's coins owned by Trump's family.",2025-10-23T16:10:06,r/cryptocurrency,dmitryaus,141,comment
t1_nkzrg8d,It’s pretty cool that you can just buy pardons now from the US president,2025-10-23T17:37:07,r/cryptocurrency,ActualSecretary9407,103,comment
t1_nl0ekqd,"Posted by Coffeezilla in X

> Backstory to CZ's pardon. 
Nov 2023 Binance and CZ plead guilty, $4B+ fine. 
Mar 2025 Trump WLFI launches stablecoin USD1.
Mar 2025 $2B investment into Binance by MGX.
May 2025 $2B investment was paid for in USD1.
May 2025 CZ admits he applied for a pardon.
Oct 2025 CZ gets a pardon.
RESULT: $USD1 is backed by treasuries, this yields ~$60-80m/year for WLFI so long as Binance doesn't redeem the $2B in USD1.

Crime season baby",2025-10-23T19:29:20,r/cryptocurrency,Dorkasteri,97,comment
t3_1o8k3xr,I’m cooked,2025-10-16T22:20:16,r/cryptocurrency,002_timmy,4485,post
t1_njvhabg,Who tf calls online trolling a hobby?,2025-10-16T22:26:37,r/cryptocurrency,jackfinch69,1180,comment
t1_njvgn9o,Don’t see porn listed anywhere. It’s the small victories that keep me going.,2025-10-16T22:22:56,r/cryptocurrency,esmoji,671,comment
t1_njvh53l,gambling is unattractive until it works,2025-10-16T22:25:46,r/cryptocurrency,Next_Statement6145,184,comment
t1_njvj8be,"hey only 4/5!

ladies?",2025-10-16T22:38:00,r/cryptocurrency,sonofbaal_tbc,163,comment
t1_njvly8z,"Least attractive female hobbies.

1.) Criticizing other people's hobbies
2.) Not having any hobbies
3.) Talking shit about random people
4.) Worried the worst possible thing can and will happen in any situation
5.) Knitting
6.) Cat collecting",2025-10-16T22:54:15,r/cryptocurrency,TheDrummingApe,138,comment
t3_1of42xc,How crypto really works,2025-10-24T17:34:05,r/cryptocurrency,Odd-Radio-8500,3889,post
t1_nl68yqc,Lol tru,2025-10-24T17:42:53,r/cryptocurrency,MVEMarJupSatUrNepPlu,68,comment
t1_nl6bgvv,You see how he is squinting through the glasses? Its because the bottom part is supposed to be blurry.,2025-10-24T17:54:58,r/cryptocurrency,MaconBacon01,63,comment
t1_nl6nkt2,"It will be first time when Nasdaq outrun the general crypto market, makes me think what will happen 10 years from now, if all alts will dump to sub $1M marketcap as bagholders escape the ship.


I might be speaking too soon but I think many alts seen more upward action in previous bear markets than the pathetic shit we have now.",2025-10-24T18:55:49,r/cryptocurrency,AutisticMisandrist,13,comment
t1_nl9w3sb,r/401jK,2025-10-25T07:42:00,r/cryptocurrency,kamikaze_punk,12,comment
t1_nl6ihkm,True but the meme is backwards....in the movie he gets spider powers and can see fine without glasses but it's blurry AF when he uses the glasses...,2025-10-24T18:30:13,r/cryptocurrency,Alimakakos,10,comment
t3_1orzjod,From Lambo dreams to real life 😆,2025-11-08T20:24:50,r/cryptocurrency,Odd-Radio-8500,3656,post
t1_nntlj23,It’s fine I bought at 115 and will sell at 89 when it’s over priced,2025-11-08T20:27:52,r/cryptocurrency,Recent_Collection_74,277,comment
t1_nntnfd2,"Patience, road back to 70k is hard",2025-11-08T20:38:34,r/cryptocurrency,fuduran,88,comment
t1_nntm8ff,Bitcoin 99k$ in november 2050: 💀,2025-11-08T20:31:41,r/cryptocurrency,Top_Invite3911,49,comment
t1_nntpjyf,Yeah one is because we were hitting all time highs at the time. Now its not as exciting because we wanted this to be a strong bull run. So having the same price as a year ago isn't to exciting given what most expected. This is still a solid price range for those not expecting it to run up way higher.,2025-11-08T20:50:37,r/cryptocurrency,MarioWilson122,42,comment
t1_nntyrk5,"Hmm seems like our pyramid scheme needs either more members or y'all just need to buy more. So come on guys stop sitting on your bags, fill em up a little more or at least tell your friends and relatives to hop on our beautiful pyramid.",2025-11-08T21:41:57,r/cryptocurrency,SlimShaco,26,comment
t3_1ohw71s,"US Rep. Ro Khanna introduces legislation to ban President DJT, congressmembers from trading crypto",2025-10-28T01:04:24,r/cryptocurrency,Dongerated,3480,post
t1_nlrjs3s,Lmao good luck.  His family is making billions from this with zero oversight and not a single person with a spine to impede.,2025-10-28T03:02:31,r/cryptocurrency,looool_k_libtard,256,comment
t1_nlr53o3,i hope it passes,2025-10-28T01:37:38,r/cryptocurrency,Next_Statement6145,155,comment
t1_nlr073k,"tldr; Rep. Ro Khanna (D-Fremont) announced legislation to ban President Trump, his family, members of Congress, and elected officials from trading cryptocurrency or stocks. This follows Trump's pardon of Binance CEO Changpeng Zhao, who was convicted for enabling money laundering linked to criminal activities. Khanna criticized the pardon as corrupt, citing Zhao's financial ties to Trump's family crypto ventures. The bill aims to prevent conflicts of interest and ensure ethical conduct among public officials.

*This summary is auto generated by a bot and not meant to replace reading the original article. As always, DYOR.",2025-10-28T01:10:05,r/cryptocurrency,coinfeeds-bot,99,comment
t1_nlr2380,Let’s fucking GO!,2025-10-28T01:20:34,r/cryptocurrency,_Piratical_,55,comment
t1_nlr8ijs,Much needed legislation but will be killed by both sides. There is just toooooo much money to be made.,2025-10-28T01:57:23,r/cryptocurrency,Mr_Locke,28,comment
t3_1odcnah,RIP crypto 😔,2025-10-22T16:13:12,r/cryptocurrency,Odd-Radio-8500,3163,post
t1_nksvvpt,"Maybe the gods will spare us because he said ""Crypo"" not ""Crypto""",2025-10-22T16:21:02,r/cryptocurrency,TechnologyMinute2714,446,comment
t1_nksw8en,Crypo,2025-10-22T16:22:44,r/cryptocurrency,_Keelo_,263,comment
t1_nksuiir,"It's going down soon, guys.",2025-10-22T16:14:24,r/cryptocurrency,ChemicalAnybody6229,65,comment
t1_nkswsny,Crypo meme coin is up and running,2025-10-22T16:25:28,r/cryptocurrency,oblongballs72,47,comment
t1_nksx0i3,"Well shit. Just when I was hoping for a green candle. 

Fuck you Cramer!",2025-10-22T16:26:31,r/cryptocurrency,_Piratical_,35,comment
t3_1ooh9sx,Well okay,2025-11-04T19:48:21,r/cryptocurrency,Fritz1818,3039,post
t1_nn42dbv,"see you next year. same place, same time",2025-11-04T19:57:59,r/cryptocurrency,Next_Statement6145,1035,comment
t1_nn424dq,"""Im so Boss tired""

Been holding on to ETH for 5 years...",2025-11-04T19:56:49,r/cryptocurrency,Arminius001,443,comment
t1_nn42yul,Tells me not to buy at 3.3k,2025-11-04T20:00:51,r/cryptocurrency,ilfollevolo,230,comment
t1_nn4157y,Stablecoins are the future and apparently the ethereum network runs on one.,2025-11-04T19:52:13,r/cryptocurrency,StatisticalMan,145,comment
t1_nn49wcx,Who's seth,2025-11-04T20:34:19,r/cryptocurrency,Alleged_Ostrich,143,comment
t3_1onkb9p,"This Redditor lost all his life savings, 6 years of DCA wiped out after cascading liquidations took out high leverage gamblers.",2025-11-03T18:49:40,r/cryptocurrency,Silver-Maximum9190,2894,post
t1_nmxeri7,im glad im too dumb to use leverage.,2025-11-03T19:04:20,r/cryptocurrency,A1JX52rentner,2059,comment
t1_nmxfosa,"“Wait for the cycle end.”

All that and still trying to time the market",2025-11-03T19:08:53,r/cryptocurrency,BitcoinMD,745,comment
t1_nmxiv14,"I don’t need to read this. He gambled, he lost. There’s no story here.",2025-11-03T19:24:36,r/cryptocurrency,coojw,582,comment
t1_nmxipha,"#DO NOT LEVERAGE, OR IF YOU DO, DONT COMPLAIN WHEN YOU LOSE IT ALL",2025-11-03T19:23:49,r/cryptocurrency,ThinCrusts,386,comment
t1_nmxfzet,"> You can roast me, but this can happen to you

Lol no bro. There are smarter ways to leverage than whatever OP did. A fucking personal loan -> Buy Bitcoin would be a better play… It will take a few months of non-payment and a lawsuit for the bank to recover and they’d get fiat, not Bitcoin. Bonus points if Bitcoin is worth more then than when acquired with the loan.",2025-11-03T19:10:20,r/cryptocurrency,GeneralZex,213,comment
t3_1ol729g,"Trump Isn’t “Pro Crypto”... He’s Pro Trump...and his gang i know u people have probably heard it before but it is way clearer now than it was a year ago. A lot of what looks like “Trump loves crypto” lines up almost perfectly with stuff that benefits him... his family... or people close to him... not the average person holding BTC on a phone.

First... the public moves. He has been saying the U S should “support” digital assets... he has framed it as ending the old “war on crypto”... and he has tried to make it sound like America is open for on chain business again. All very loud... very pro innovation.

At the same time... reports this year said the Trump family’s own crypto and token ventures have pulled in hundreds of millions of dollars... in the same window when the administration was sounding the most crypto friendly. That overlap is hard to ignore. It looks less like “pro crypto” and more like “we made it friendlier while we were selling.”

Then there was the CZ pardon. Call it mercy if you want... but it was clearly a made-for-one-person decision. In the months leading up to it... Binance and CZ brought on Trump-aligned lobbyists... hired a D.C. firm close to his circle and spent serious money... and looped in a former SEC-adjacent lawyer who already had credibility with the new team. Several reports said the clemency push went through political channels... not the usual DOJ path. So this wasn’t “the administration helped crypto”... it was “a well connected crypto billionaire bought his way to the front of the line.”

Now add the tariff noise. Every time he rattles trade partners... Canada... Europe... whoever... it makes legacy markets nervous and pushes some attention back toward crypto... while his circle is the group most ready to sell... raise... and market in that environment. Convenient timing.

One more angle most people miss. The more this stuff turns into “policy for friends,” the messier your own taxes get because now you’re mixing airdrops, political tokens, pardoned-exec pump candles, prediction style gains etc. I’ve started tracking those flows separately in Awaken tax instead of just throwing it all under “capital gains,” because if the rules keep getting written by insiders I do not trust the IRS to be chill about how I label income later. That part is self defense not shill.

So yeah... he is not “pro crypto” the way CT means it. He is pro... his... crypto. Pro... his donors’... crypto. Pro... his friends’... crypto. Everyone else still has to buy tops and read press releases.",2025-10-31T21:39:48,r/cryptocurrency,hodorrny,2833,post
t1_nmfyyjf,You don’t say…,2025-10-31T21:56:02,r/cryptocurrency,Jazzlike-Lion2969,225,comment
t1_nmfyqoz,"He isn't pro USA either

Edit: To keep things on topic. Someone who shills their own meme coin to the American people only to rug for slef profit is certainly not pro USA. It's disgusting behavior even for the lowest of criminals let alone the ""president"" of the United States.",2025-10-31T21:54:44,r/cryptocurrency,Livid_Yam,96,comment
t1_nmg195l,"You should have known as soon as he dropped Trump coin he has no loyalty to bitcoin or any particular crypto,  just the ability for anyone to run whatever scam they want without regulation. Think republican values but also with a splash of corruption to his benefit. He's basically pro stablecoin and pro trump coin and pro cronos etc",2025-10-31T22:10:21,r/cryptocurrency,tesseramous,82,comment
t1_nmfxgpf,We all knew this a long time ago,2025-10-31T21:47:02,r/cryptocurrency,particlecore,54,comment
t1_nmfyw6l,He’s a fucking con artist! He cares about Trump! That’s it!,2025-10-31T21:55:39,r/cryptocurrency,papernotplastic2,32,comment
t3_1o9qrt0,Free crypto advice,2025-10-18T08:52:06,r/cryptocurrency,Odd-Radio-8500,2817,post
t1_nk432v7,Always & I mean ALWAYS inverse Cramer.,2025-10-18T08:56:34,r/cryptocurrency,MichaelAischmann,139,comment
t1_nk442p8,I said bye crypto,2025-10-18T09:07:17,r/cryptocurrency,AdministrativeMeal20,56,comment
t1_nk455iw,"Crypto is the only way to become Millionaire.

But from being a Billionaire.",2025-10-18T09:18:49,r/cryptocurrency,CoolCoolPapaOldSkool,41,comment
t1_nk472wq,"He was saying that two weeks ago when we were at $125k...

It was all obvious in hindsight.",2025-10-18T09:39:29,r/cryptocurrency,partymsl,38,comment
t1_nk456cm,just sold everything thanks for the advice jimmy,2025-10-18T09:19:04,r/cryptocurrency,CoolBabyDoingStuff,9,comment
t3_1okdiod,Crypto in 2025,2025-10-30T22:20:34,r/cryptocurrency,Fritz1818,2649,post
t1_nma4ffz,the fact that we’ve all said this before at least once😂,2025-10-30T23:23:17,r/cryptocurrency,YWMJ,141,comment
t1_nm9u55u,Por flavor.,2025-10-30T22:25:11,r/cryptocurrency,Intelligent_Page2732,130,comment
t1_nma2wgw,Idc about getting my money back. Retirement or bust,2025-10-30T23:14:45,r/cryptocurrency,themrgq,65,comment
t1_nma6c99,Profits?   Profits?  Who’s making profits?,2025-10-30T23:34:01,r/cryptocurrency,Dazslueski,49,comment
t1_nmbysqx,Trump fuckt up our bullrun!,2025-10-31T07:19:29,r/cryptocurrency,BGM1988,23,comment
t3_1oq5lcq,"In Seoul Korea, perp trading is an E-sport, 1001x leverage isn’t enough ammo. Respawn after liquidation. The thrill is real.",2025-11-06T17:45:12,r/cryptocurrency,Silver-Maximum9190,2600,post
t1_nngeeiz,"This has to be the dumbest shit I've seen today! 😂


Do they use real cash or is it simulated? 
Some people have more money than sense!",2025-11-06T17:53:19,r/cryptocurrency,Gangaman666,719,comment
t1_nnginyq,"This is so fucking regarded, I love it. What a time to be alive

Edit: anywhere you can bet on this? Asking for me",2025-11-06T18:13:30,r/cryptocurrency,CheekiTits,230,comment
t1_nngdfxx,"Wow. They even have sponsors.

I wonder what their APM is.",2025-11-06T17:48:45,r/cryptocurrency,HSuke,162,comment
t1_nngkakc,Degening into the next level,2025-11-06T18:21:09,r/cryptocurrency,kirtash93,132,comment
t1_nngmjvd,I can’t wrap my head around this….but I guess this is like watching someone in Vegas at the blackjack table?  You are basically watching digital gambling….seems odd,2025-11-06T18:31:40,r/cryptocurrency,matthegc,44,comment
t3_1otgmr0,All It Takes Is A Tweet Source: [https://x.com/DeepBlueCrypto/status/1985147757342884169?s=20](https://x.com/DeepBlueCrypto/status/1985147757342884169?s=20),2025-11-10T15:24:15,r/cryptocurrency,kirtash93,2348,post
t1_no4b76v,Big Donny T keeping cryptobros in the perfect balance of anxiety and dread 24/7.,2025-11-10T15:28:40,r/cryptocurrency,CheekiTits,65,comment
t1_no4ggit,How about reverse scenario? I tweet sends to the moon.,2025-11-10T15:54:36,r/cryptocurrency,Ronaldinho94,24,comment
t1_no4ebch,This is true for your stock portfolio as well.,2025-11-10T15:44:09,r/cryptocurrency,soyuz-1,21,comment
t1_no4f5b9,"That's all it takes to nuke, but also pump the market these days",2025-11-10T15:48:14,r/cryptocurrency,NotThe1stNoel,7,comment
t1_no4eye7,There is alwasy something. If it's not a trump tweet it's some fake news... Stable and healthy markets can't be moved by tweets though. Just saying,2025-11-10T15:47:17,r/cryptocurrency,JakRenden2,5,comment
t3_1okb436,Summary Of October,2025-10-30T20:42:23,r/cryptocurrency,TheGreatCryptopo,2266,post
t1_nm9bzq3,Uptober my ass,2025-10-30T20:49:03,r/cryptocurrency,kitbiggz,159,comment
t1_nm9jbxw,"Bear market… bull started early by trumps pro crypto stance, and then he fucked up the bullrun itself, see you guys back in 2029!",2025-10-30T21:25:58,r/cryptocurrency,BGM1988,63,comment
t1_nm9gzok,It's not a dip until it hits like 60k. Then buy.,2025-10-30T21:13:55,r/cryptocurrency,ShredGuru,22,comment
t1_nm9ippy,Most obvious Rektober after everyone snd their moms were calling for Uptober.,2025-10-30T21:22:47,r/cryptocurrency,partymsl,18,comment
t1_nm9frqq,"Dumbvember will be pumpvember then?

![gif](giphy|a5viI92PAF89q)",2025-10-30T21:07:47,r/cryptocurrency,kirtash93,13,comment
t3_1o7lu02,I Can't Do it Master,2025-10-15T20:13:31,r/cryptocurrency,goldyluckinblokchain,2263,post
t1_njolkif,"The human being has two kidney, but only needs one to survive. 

Do with that what you will.",2025-10-15T20:27:32,r/cryptocurrency,partymsl,138,comment
t1_njok4o3,"mf’s don’t get bored of posting the same bs meme’s? 

also what dip?",2025-10-15T20:20:17,r/cryptocurrency,Neat-Ad2953,35,comment
t1_njorplh,I bought most of my crypt near the peak of the 2021 hype. So you can imagine how I feel.,2025-10-15T20:58:44,r/cryptocurrency,Electrical-Penalty44,22,comment
t1_njolvrk,When the Sahara desert is more liquid than your fiat wallet.,2025-10-15T20:29:06,r/cryptocurrency,MichaelAischmann,21,comment
t1_njotvt4,Just take a loan like a true degen??,2025-10-15T21:10:09,r/cryptocurrency,crazy_lolipopp,12,comment
t3_1oie58h,Giant Bitcoin drone show in Switzerland showing BTC eating fiat currencies like Pac-Man,2025-10-28T16:31:02,r/cryptocurrency,002_timmy,2231,post
t1_nlur8t2,"Did this actually happen or is it ai propaganda? Need a source

Edit: just checked, it actually happened. Can’t ever believe shit in this space without verifying",2025-10-28T16:36:42,r/cryptocurrency,Goosemilky,295,comment
t1_nluuhlw,Well that's really cringe,2025-10-28T16:52:16,r/cryptocurrency,B1rdi,159,comment
t1_nlusxsa,Everyone just jacking each other off over bitcoin while watching a drone show. nice.,2025-10-28T16:44:52,r/cryptocurrency,888z,120,comment
t1_nluzan2,oof. the cringe is strong with this one.,2025-10-28T17:14:57,r/cryptocurrency,dondondorito,55,comment
t1_nluv5j1,I know this is a crypto sub but somehow this doesn't seem like a good sign to me,2025-10-28T16:55:24,r/cryptocurrency,4444444vr,53,comment
t3_1oesuqa,Trader who made $190M shorting crash also apparently bet on CZ’s pardon,2025-10-24T09:07:35,r/cryptocurrency,Next_Statement6145,2134,post
t1_nl3tvjl,Is this trader called Donald by any chance?,2025-10-24T09:12:36,r/cryptocurrency,AgitatedDragonfly769,826,comment
t1_nl3ut1l,"damn, he’s winning on every front

does he know some shit about fuck?",2025-10-24T09:21:51,r/cryptocurrency,DryMyBottom,420,comment
t1_nl3xzcl,Crime is legal but only if you’re in the right club,2025-10-24T09:52:23,r/cryptocurrency,FantasticCourt2647,344,comment
t1_nl3u0sw,"Fucking hell, this is hilarious.",2025-10-24T09:14:07,r/cryptocurrency,rootpl,236,comment
