id,text,date,source,author,score,type
t1_nmvw0gp,Famous last words,2025-11-03T14:38:29,r/bitcoin,2xfun,64,comment
t1_nmvr6w1,"Beautiful chart, only way we would cross it in the upcoming years is if we drop like another 50-60%.

Breakfast: Protein oatmeal and black coffee!",2025-11-03T14:12:44,r/bitcoin,LifterNineFour,48,comment
t3_1ogk7cd,"Maximum respect for the guy who posted this image at 103 I don’t know who it was, but he has my utmost respect. I was panicking that day (this image had a huge impact on me), and now I’m laughing about it… Huge respect to the subreddit as well!",2025-10-26T13:09:11,r/bitcoin,Kind_Cheetah_1289,1024,post
t1_nlh0irx,If you're panicking at $103k and even thinking about selling you gotta change your perspective about btc.,2025-10-26T13:21:13,r/bitcoin,wo0two0t,286,comment
t1_nlh0ucq,Is this how I sounded 6-7 years ago?,2025-10-26T13:23:13,r/bitcoin,Bacon-Dub,67,comment
t1_nlh2ds8,Panic sell at 103? 😂 gtfo,2025-10-26T13:32:50,r/bitcoin,MarkItZeroDonnie,56,comment
t1_nlh0ovw,"You will also laugh about this in a few years, how crazy it is that you think a guy is a legend that got through a 20% drop in btc. (rookie numbers bro)",2025-10-26T13:22:16,r/bitcoin,ledav3,23,comment
t1_nlh219h,I remember people posting this image at 3k.,2025-10-26T13:30:40,r/bitcoin,Weigh13,17,comment
t3_1oneurq,What is going on?,2025-11-03T15:32:33,r/bitcoin,Thefuntruck,1017,post
t1_nmw899g,Time to sell and buy again when its 120k,2025-11-03T15:40:04,r/bitcoin,nombresinhombre,2121,comment
t1_nmw79u4,"Believe it or not, BTC used to be 10x more volatile. This is just regular price action",2025-11-03T15:35:17,r/bitcoin,TexasBoyz-713,1211,comment
t1_nmw6va8,[deleted],2025-11-03T15:33:18,r/bitcoin,[deleted],471,comment
t1_nmw6yz6,"Longs are getting liquidated. Don't play at the casino when the big boys are in the game. People betting on margin are getting destroyed right now, then when the market clears they will go destroy the shorts and push the price to 130k rinse and repeat until you bankrupt day traders. Happens in every market.

For people buying and holding long term this doesn't matter, this only screws you when you're trading with leverage.",2025-11-03T15:33:48,r/bitcoin,Darkpriest667,407,comment
t1_nmw8154,"I bought 500 usd worth of BTC yesterday, that's what happened.",2025-11-03T15:38:58,r/bitcoin,longwoody,172,comment
t3_1os3ito,"There’s now a 48% chance #Bitcoin hits $1,000,000 before GTA 6 releases, according to Polymarket. I'd bet on that",2025-11-08T23:14:26,r/bitcoin,tommy4019,1017,post
t1_nnuh5oy,Lol im not sure if this is bullish on bitcoin or extremely bearish on gta6.  😂,2025-11-08T23:30:49,r/bitcoin,EnvironmentalLaw4056,523,comment
t1_nnuhrss,The bet returns 50/50 if be it her happens by a certain date in like 2026.  So the 48 percent chance is really tracking the probability that neither will happen.,2025-11-08T23:34:42,r/bitcoin,UrbanPugEsq,93,comment
t1_nnuk7kb,"That's not how Polymarket works. The bets don't continue indefinitely into the future - they have an end date, and if we reach the end date and neither thing has happened, the bet returns 50/50. 

With the current 48% odds, this means that if neither Bitcoin $1M nor GTA 6 happen before the market closes in 2026, the people who bet on GTA 6 happening first would make a small amount of money, and the people who bet on Bitcoin would lose a small amount of money.

If either thing actually happens before the end date, you'd either roughly double your money, or straight up lose your money. 

Most people betting on this market expect neither to actually materialize, but expect future news to cause a shift where one becomes slightly more likely than the other, some time between now and the end date. Then they'll cash out their position and make (or lose) a small amount of money, but few people will hold until the very end.",2025-11-08T23:49:46,r/bitcoin,usicafterglow,84,comment
t1_nnuiqpn,"You misunderstood it.

It’s 48% chance that BTC will hit 1 million before 31st July 2026 AND be this being earlier than GTA 6 release",2025-11-08T23:40:45,r/bitcoin,Ok-Dimension-7859,30,comment
t1_nnueswe,I’ll bet you. How much?,2025-11-08T23:16:05,r/bitcoin,OldMinute5727,14,comment
t3_1ok1qwg,Bitcoin Drone Show Time Lapse,2025-10-30T14:48:50,r/bitcoin,FutureVision45,1016,post
t1_nm7apiu,finally some decent content,2025-10-30T14:58:42,r/bitcoin,itsdabtime,52,comment
t1_nm79kni,Wild stuff,2025-10-30T14:53:12,r/bitcoin,prguitarman,18,comment
t1_nm7lryb,[Click here if you would like to watch a video of the entire 11 minute drone show with audio](https://www.reddit.com/r/Bitcoin/comments/1ohjrzs/a_video_of_the_entire_drone_show_at_the_plan/) (not sped up),2025-10-30T15:51:23,r/bitcoin,Onalerono,15,comment
t1_nm7cdfd,Where??,2025-10-30T15:06:49,r/bitcoin,BernardMarxx,10,comment
t1_nm7j5pa,"That's awesome. Where can I get the full, non-sped-up, video?",2025-10-30T15:39:05,r/bitcoin,757packerfan,3,comment
t3_1o6i9mb,It is impossible to fake energy,2025-10-14T15:15:07,r/bitcoin,Jeovanni98,1017,post
t1_njgnhmj,Im waiting for Powell speech to execute my daily DCA,2025-10-14T15:26:39,r/bitcoin,SnowImportant4517,82,comment
t1_njgqc3v,When was this posted?,2025-10-14T15:41:05,r/bitcoin,BTC_is_waterproof,29,comment
t1_njgmyvl,Hate Elon but hes right.,2025-10-14T15:24:02,r/bitcoin,bookofp,27,comment
t1_njgomyy,how much btc does Elon have🤔,2025-10-14T15:32:27,r/bitcoin,smokeshow420420,24,comment
t1_njgmx38,The first cool Elon post I’ve seen in ages — just because it’s true.,2025-10-14T15:23:47,r/bitcoin,AstonMarco,18,comment
t3_1oinnyn,You’re going sane in an insane world,2025-10-28T22:32:48,r/bitcoin,BTC_is_waterproof,1001,post
t1_nlwsb09,A lot of people act like they feel this way when it goes up but then panic when it drops 5% 😂,2025-10-28T22:36:53,r/bitcoin,Profit-Silly,108,comment
t1_nlwscba,Money doesn’t need to be inflationary…no matter how many times those dumb fucks say it,2025-10-28T22:37:05,r/bitcoin,ChaoticDad21,46,comment
t1_nlwta6c,"thank you chatgpt, I know I am the smartestest and prettiest",2025-10-28T22:42:16,r/bitcoin,Mysterious_Mouse_388,25,comment
t1_nlwtfll,"I believe in btc as much as the next dude here, but this is so corny omg",2025-10-28T22:43:06,r/bitcoin,Every_Sugar2120,24,comment
t1_nlwvut2,Every bear market shakes out the tourists. What’s left are the ones who get it,2025-10-28T22:56:08,r/bitcoin,Tomato_Soup404,10,comment
t3_1ore2p9,Let's not forget,2025-11-08T02:45:06,r/bitcoin,erockskop,981,post
t1_nnpqgnf,This is what started it all,2025-11-08T04:04:31,r/bitcoin,Comfortable_Radio384,60,comment
t1_nnpyhhm,I wish Reddit would bring back sub member count. We were about to pass like 8 million right?,2025-11-08T05:06:56,r/bitcoin,StoneHammers,28,comment
t1_nnplx3l,"This is so cool, for real.",2025-11-08T03:31:27,r/bitcoin,el_rico_pavo_real,21,comment
t1_nnpuxm1,"Hoooorayyyyyy! It's been a while since I found the version where it says ""join us"". I'm so happy!",2025-11-08T04:38:56,r/bitcoin,airportdelay,6,comment
t1_nnqayvk,“Magic Internet money goes Brrrr” a rule to remember.,2025-11-08T06:59:45,r/bitcoin,Agreeable-Computer45,4,comment
t3_1oshwza,Talk about Early.,2025-11-09T12:16:50,r/bitcoin,No-Focus-1429,984,post
t1_nnx6pgy,"Before y’all start crying about it, you probably would’ve lost the access to the wallet or sell it all once it hit like $20 lmao.",2025-11-09T12:36:55,r/bitcoin,Lewcaster,145,comment
t1_nnx4h9w,Dun loose ur drive and forget your password god damn .,2025-11-09T12:18:46,r/bitcoin,Dafishy81,55,comment
t1_nnx84dd,"That's a fake (ai generated) video afaik, just making the rounds on twitter by the usual ""influencers"" for engagement",2025-11-09T12:47:52,r/bitcoin,TheGreatMuffin,26,comment
t1_nnxc7w0,How many 'fell for it again' awards have these Bitcoin influencers accumulated now?,2025-11-09T13:17:24,r/bitcoin,jmomentum,8,comment
t1_nnxpxin,I can shave my both balls if he can prove he held until BTC was $100,2025-11-09T14:42:40,r/bitcoin,No_Shower_1702,5,comment
t3_1o97j29,Bottom signal,2025-10-17T17:25:41,r/bitcoin,Redditistuncool,980,post
t1_nk0877t,This guy has made a career out of being wrong on Bitcoin,2025-10-17T17:29:48,r/bitcoin,BTC_is_waterproof,687,comment
t1_nk09yjq,"What happens if Schiff predicts a crash while Jim Cramer predicts ""up or sideways""?  How would the universe resolve a paradox like that?",2025-10-17T17:38:32,r/bitcoin,Deacon86,246,comment
t1_nk08pjk,Schiff indicator hitting again means buy fucking satoshis,2025-10-17T17:32:19,r/bitcoin,Complete-Nothing-758,81,comment
t1_nk0ah2i,Lol not too long ago this idiot said btc would never get above 100k and yet here we are,2025-10-17T17:41:04,r/bitcoin,wolf_of_mainst99,49,comment
t1_nk08al8,Can someone please hide this guys phone or computer.....,2025-10-17T17:30:16,r/bitcoin,ShipMysterious7602,46,comment
t3_1oqsall,You all are welcome,2025-11-07T11:48:12,r/bitcoin,Amber_Sam,969,post
t1_nnl9zji,let me buy some so we can all buy more when it dips further,2025-11-07T13:14:29,r/bitcoin,Pfaerd,19,comment
t1_nnm1p9d,Come on. Buying the perfect dip is just as difficult as selling at the absolut top. Rule number 1: Time in the market is better than timing the market.,2025-11-07T15:43:17,r/bitcoin,AstonMarco,10,comment
t1_nnlq5vx,This is why we DCA,2025-11-07T14:44:43,r/bitcoin,wackyasshole,5,comment
t1_nnnmwpt,"If the current downturn coincides properly with the government shutdown, I guess if we're buying now we're betting that the government shutdown ends some time next week.   I've put another $100 in.   The shutdown can't last forever.   Of course this only works if the Bitcoin and stockmarket rebounds after the shutdown and doesn't just sit there.",2025-11-07T20:27:54,r/bitcoin,shizoor,5,comment
t1_nnlnjmr,oh damn i thought it was me,2025-11-07T14:30:42,r/bitcoin,Bubbly_Ice3836,4,comment
t3_1oa7q5h,Bitcoin was $400,2025-10-18T21:19:23,r/bitcoin,Kazgarth_,953,post
t1_nk7g945,Tomorrow is my turn to post this! 😁,2025-10-18T21:31:57,r/bitcoin,kaphwor,66,comment
t1_nk7lkj5,Bitcoin has more than 9 lives,2025-10-18T22:02:36,r/bitcoin,shayKyarbouti,25,comment
t1_nk7t4xk,« Rumours of my death have been greatly exagerrated »,2025-10-18T22:48:04,r/bitcoin,Calm-Professional103,8,comment
t1_nk7f4le,🤣🤣🤣🤣,2025-10-18T21:25:23,r/bitcoin,Technical-Wallaby,7,comment
t1_nk7l8td,Yeah Bitcoin will die horribly if Donald Trump adopts it as its own. But until that fateful day I think we are safe. 🤣🤣,2025-10-18T22:00:43,r/bitcoin,Deathstoned11,7,comment
t3_1oqajmw,"JP Morgan Chase said earlier today that Bitcoin was undervalued by $68k. Fair value would be $170k Here's the link to the article:

https://cointelegraph.com/news/bitcoin-68k-too-low-versus-gold-says-jpmorgan-btc-stocks-dip",2025-11-06T20:51:19,r/bitcoin,WoodWizards,952,post
t1_nnhh0gp,"So what? 
How are we supposed to respond to something like that from someone like them?",2025-11-06T21:00:30,r/bitcoin,marshyr3d1and,165,comment
t1_nnhgvmc,All the top signals firing.,2025-11-06T20:59:51,r/bitcoin,Superblegend92,67,comment
t1_nnhulyl,Guess they're bagholding hard like the rest of us,2025-11-06T22:06:58,r/bitcoin,Outrageous_Word_999,57,comment
t1_nnhoxgk,JP Morgan called BTC scam while secretly buying on German nasdaq back under $1.5k,2025-11-06T21:38:55,r/bitcoin,Street_Outside_7228,20,comment
t1_nnhpogf,see y'all at 50k,2025-11-06T21:42:35,r/bitcoin,steaveaseageal,16,comment
t3_1ocfp7y,Looks like uptober is back on the menu boys,2025-10-21T15:16:11,r/bitcoin,Mantis-Prawn,909,post
t1_nkm31lr,I love volatility every time it‘s upwards 😁,2025-10-21T15:21:15,r/bitcoin,AstonMarco,86,comment
t1_nkm3myl,This is the shitpost I've been waiting for.,2025-10-21T15:24:20,r/bitcoin,WMullarky,56,comment
t1_nkm5qbj,"+1% it's Uptober

-1% it's Octover

I'm tired...",2025-10-21T15:35:13,r/bitcoin,1002jacktom1002,52,comment
t1_nknim97,Aaaaaand its gone,2025-10-21T19:29:12,r/bitcoin,ioskar,46,comment
t1_nkm3tsb,This market is driving people crazy. Luckily I HODL and having fun seeing traders get rekted constantly.,2025-10-21T15:25:19,r/bitcoin,justanotheruser-o_o,29,comment
t3_1och0k9,"Gold drops, BTC pumps. The rotation is happening.",2025-10-21T16:05:56,r/bitcoin,alancarroII,901,post
t1_nkmdez6,This is a bold conclusion for one day,2025-10-21T16:14:49,r/bitcoin,Rolldice08,247,comment
t1_nkmfvi9,OMG gold drop down where it was 4 days ago 🫨😵‍💫😱😱,2025-10-21T16:27:31,r/bitcoin,Shrek_Nietszche,114,comment
t1_nkme88f,So glad I kept DCA when it dropped,2025-10-21T16:19:01,r/bitcoin,Working_Spite_2285,15,comment
t1_nkmrkez,Dude it's been like 12 hours,2025-10-21T17:23:19,r/bitcoin,Scholes_SC2,15,comment
t1_nkmc76p,pamp it,2025-10-21T16:08:30,r/bitcoin,Complete-Nothing-758,13,comment
t3_1ohmd8c,Look what I found in my city,2025-10-27T18:28:24,r/bitcoin,_Jokki,885,post
t1_nlp3k74,Simon's cat in on it too,2025-10-27T19:02:08,r/bitcoin,Longjumping_Animal29,12,comment
t1_nlr21rs,Did you find it five seconds after you put it there?,2025-10-28T01:20:20,r/bitcoin,annnaaan,9,comment
t1_nlpb400,"If that’s not a sign bitcoin is going much higher, I don’t know what is 
 I’m all in",2025-10-27T19:40:41,r/bitcoin,obscureobject2574,5,comment
t1_nlrmyn8,Ahhh so cute 🥹,2025-10-28T03:22:53,r/bitcoin,BitMartExchange,1,comment
t1_nlstwh7,Simon must have few 😂,2025-10-28T09:38:27,r/bitcoin,xite2020,1,comment
t3_1o97gd2,Traders: BTC is dead again.,2025-10-17T17:22:51,r/bitcoin,SetNo6506,874,post
t1_nk0fguh,[deleted],2025-10-17T18:05:57,r/bitcoin,[deleted],68,comment
t1_nk0lhv8,Take it easy on the buttcoiners. They all have a nasty case of blueballs waiting for bitcoin to finally tank. These dips are the closest thing they get to the big win before it starts creeping back up and blasting off all over again. It's got to be exhausting.,2025-10-17T18:37:05,r/bitcoin,GhostRadio6113,19,comment
t1_nk18o20,"Global volatility -> Bitcoin volatility ->Price goes down

And somehow people decide its time to sell their ticket and get off the lifeboat and buy tickets for the casino room on the titanic.",2025-10-17T20:36:53,r/bitcoin,Lurked_Emerging,4,comment
t1_nk09kuy,🤡,2025-10-17T17:36:38,r/bitcoin,Sazmining,4,comment
t1_nk2rkw3,Yeah man im holding.. I know ow how this roller-coaster goes,2025-10-18T02:07:07,r/bitcoin,Thin_Cod6000,3,comment
t3_1o9avj0,Close friend with a PhD just sent me this... you're probably early,2025-10-17T19:33:31,r/bitcoin,M3174W4Y,870,post
t1_nk17fcs,"I never ""orange-pill"" people. But if they genuinely ask about Bitcoin, I share the word of Satoshi with them.",2025-10-17T20:30:25,r/bitcoin,Nyanzerfaust,271,comment
t1_nk14eju,"Sincerely don't understand why everyone is crapping all over OOP. It's not a stupid question at all if you're familiar with markets and investing, but not Bitcoin itself.

When you're fractionally buying into gold, asking whether you're getting a piece of a gold bar or what isn't stupidity, just ignorance.

All you old-school HLODers who think you're ""above the rest"" maybe need to re-evaluate the stupidity/ignorance you brought to the table when you yourself didn't know anything.

Quick, all of you geniuses... if you wanted to participate in BRK-A shares, which are presently trading north of $700,000 a share, what would you do? What, you don't know? HAHAHAHA LET'S ALL LAUGH AT YOU.

I hope you ""holier than thou"" crowd learn that maybe it's better to help educate people than you laugh at their questions. 

This guy with a PhD probably knows a hell of a lot more than most of us about some very specific topics, and he'd probably be happy to share that info.",2025-10-17T20:14:47,r/bitcoin,canada11235813,261,comment
t1_nk12lu6,I mean… why shit on it? We want the world to see the scam that is the dollar. Help him!,2025-10-17T20:05:28,r/bitcoin,yefuck,186,comment
t1_nk0yh6r,What does having a PhD have to do with investing?,2025-10-17T19:44:19,r/bitcoin,TurbodToilet,84,comment
t1_nk16bvk,The CEO of this stock lowered prices so everyone could hop aboard,2025-10-17T20:24:44,r/bitcoin,Illustrious_Ant_9242,28,comment
t3_1okpdaw,Who else noticed this pattern?,2025-10-31T08:50:26,r/bitcoin,Mantis-Prawn,867,post
t1_nmc7vaa,The famous Tyrannosaurus Rekts pattern.,2025-10-31T08:54:01,r/bitcoin,eetaylog,109,comment
t1_nmcdctr,"Come on now, reach for that higher apple mf.",2025-10-31T09:48:46,r/bitcoin,4Jay_K,27,comment
t1_nmcaqqp,"Wooh wooh wooh. Does that mean bitcoin is 1 quadtrillion per coin, by the end of the year?",2025-10-31T09:23:03,r/bitcoin,hades661,15,comment
t1_nmd1usk,"I love it..... more accurate than most.

You need to create a YouTube video with the headline ""You only have two months left...""  and then just calmly discuss this chart as if it really means something.",2025-10-31T12:50:02,r/bitcoin,BeachedinToronto,10,comment
t1_nmcord8,Now THAT`S what I call technical analysis.,2025-10-31T11:24:11,r/bitcoin,SendBobsAndVagenePls,6,comment
t3_1oq3tak,"Laugh Now, Cry Later.",2025-11-06T16:38:49,r/bitcoin,No-Focus-1429,849,post
t1_nng32ur,Incredible to see critics turning into Bitcoiners.,2025-11-06T16:58:39,r/bitcoin,Amber_Sam,42,comment
t1_nngaut9,"Whole market is down, not just bitcoin. Best time to buy if you can afford it!",2025-11-06T17:36:23,r/bitcoin,averyfunkybear,28,comment
t1_nngvn10,"It's over $100k USD... 

I swear attention spans get smaller every year. You don't even have to zoom out that far.",2025-11-06T19:14:48,r/bitcoin,mitch8845,12,comment
t1_nngwprj,You know Bitcoin is still up 12% on the year. It's still outperforming the SP 500.  I would suggest that anyone dunking on it right now is an imbecile and not worthy of response,2025-11-06T19:20:06,r/bitcoin,EggMedical3514,10,comment
t1_nngp66g,"If people haven't learned all these years, then I suggest genuinely staying out of the game, forever. 

It's laughable the thinking of these people.",2025-11-06T18:43:55,r/bitcoin,Morningrise22,3,comment
t3_1oklzwg,"BTC will go very very high (to 1 million and to 10 million per coin) Bros i don’t even have to do charts anymore. 

no TA, no on-chain, no halving cycles, nothing ( I know I said logic and numbers before).  But i’ve cracked the real formula for why bitcoin will go VERY VERY HIGH.

see, back in the early 2010s i had close to 50 btc. yeah. i sold them all when it hit around $300 because i thought i was a genius. since then i’ve been secretly wishing for bitcoin to crash… like really crash… just so i could feel smart again.

  
but the universe looked me dead in the eye and said “nah bro, you’re gonna watch this thing moon forever.”

that’s it. that’s the logic. not supply and demand, not S2F, not macro trends! 

just pure universal spite. bitcoin’s one and only mission is to make *me personally* feel bad.  
so if you see it going up, remember: it’s not because of ETFs or adoption or halving.. it’s because the universe hates me and wants to rub it in.

and for that reason alone, it’s going to go VERY. VERY. HIGH.

  
Keep stacking sats broooos",2025-10-31T05:05:55,r/bitcoin,Financial-Nature5745,841,post
t1_nmc3j37,"Well I counter you, I bought yesterday so there will be a huge crash 
yall are welcome",2025-10-31T08:09:03,r/bitcoin,2Phasey,233,comment
t1_nmbsljf,"I just had a dream it hit 1M , it was at 400K and went parabolic. Crazy",2025-10-31T06:15:51,r/bitcoin,CharacterWish3708,119,comment
t1_nmblp96,"Dude thought he was a genius in 2010 when he sold his 50 bitcoin, lets all listen to his advice /s",2025-10-31T05:09:18,r/bitcoin,Budget_Break_3923,65,comment
t1_nmbzis1,the only way it gets worse is you invested in gold and then sold gold to go all in on Monkey-jpegs.,2025-10-31T07:27:10,r/bitcoin,theMonkeyTrap,60,comment
t1_nmbltmi,Please do NOT call me “bro”,2025-10-31T05:10:23,r/bitcoin,tungfa,43,comment
t3_1og4ew2,Bitcoin will be $1M in 2030 I wonder how much purchasing power $1M will have in 2030 tho.,2025-10-25T22:22:49,r/bitcoin,FarBad1864,834,post
t1_nldxvyt,"This would be great, 10x would be a good start for my pension fund",2025-10-25T22:43:20,r/bitcoin,Moose_Corn,245,comment
t1_nldvxmf,Inflation eats away roughly 3% purchasing power per year so in 2030 I think $1 million will buy what about $900k can buy you today,2025-10-25T22:31:32,r/bitcoin,Material-Statement50,196,comment
t1_nle01a0,This sub is so fucking delusional man,2025-10-25T22:56:22,r/bitcoin,HadetTheUndying,122,comment
t1_nldvvs3,Be realistic. It will be between 300k and 400k.,2025-10-25T22:31:13,r/bitcoin,Lost-Bowl3269,91,comment
t1_nle1bzb,"Right on time for the daily crystal ball price prediction shitepost, give it a break",2025-10-25T23:04:15,r/bitcoin,d3c0,71,comment
t3_1oj8q83,So close yet so far,2025-10-29T16:11:13,r/bitcoin,Kazgarth_,822,post
t1_nm1e2ax,lol guys we are not even back at all time high,2025-10-29T16:59:46,r/bitcoin,Citro31,38,comment
t1_nm2wbe0,"What is $130,0000?",2025-10-29T21:14:13,r/bitcoin,chewyjackson,21,comment
t1_nm1d0ag,So close you can smell it.,2025-10-29T16:54:54,r/bitcoin,509BandwidthLimit,21,comment
t1_nm2c5ya,"Well if you all remember at last fed rate cut the price dipped deep for maybe a week before hitting new ATH.   
History doesn't repeat but I'd be surprised if BTC didn't hit 130 by end of year.",2025-10-29T19:40:01,r/bitcoin,TheKnight_King,15,comment
t1_nm1arhf,He finds out that she is a he and there’s a flash crash lol,2025-10-29T16:44:29,r/bitcoin,DreamingTooLong,7,comment
t3_1oq35dt,That horrible feeling you have watching Bitcoin drop to $100k Will someday be experienced by people watching it drop to $1M,2025-11-06T16:14:08,r/bitcoin,Whereas-Informal,821,post
t1_nnfwalq,You know what is horrible? Let me tell you the horrible is when you dont have money to buy discount bitcoin,2025-11-06T16:26:07,r/bitcoin,Successful_Week9211,885,comment
t1_nnfv37h,"Horrible? $100k?

I watched it dump from $21k to 4k in 2017/2018. 

This is literally nothing.",2025-11-06T16:20:24,r/bitcoin,RamoneBolivarSanchez,447,comment
t1_nnfvtj5,"If you find it horrible to see BTC drop, crypto might not be for you buddy",2025-11-06T16:23:52,r/bitcoin,jacob2884r,90,comment
t1_nnfw0kf,I watched it drop from $28 to $1. Still held.,2025-11-06T16:24:48,r/bitcoin,JohnMunchDisciple,59,comment
t1_nnfu8d1,This is a wonderful feeling? Stack sats 💪🏻,2025-11-06T16:16:21,r/bitcoin,BondMi6,41,comment
t3_1of2mg6,Most of my friends be like 😂🤦,2025-10-24T16:38:28,r/bitcoin,Ayymansaeedh,811,post
t1_nl65h1t,I was the only one who was surprised when my friend immediately changed the subject after such a question?),2025-10-24T17:25:59,r/bitcoin,thehappycomputer,9,comment
t1_nla134h,Lmao I’m going to use this in real life!,2025-10-25T08:30:51,r/bitcoin,BraveTrades420,5,comment
t1_nl8ngr7,i think he meant “useless“ in terms of use case 🤔,2025-10-25T01:47:20,r/bitcoin,AK24_70,4,comment
t1_nld642u,That’s a good one. Gonna remember this,2025-10-25T20:10:22,r/bitcoin,3raindamage,1,comment
t1_nlpraks,The Zimbabwe dollar is worthless.  Doesn't mean I have the ability to give you one.,2025-10-27T21:02:32,r/bitcoin,briguy1313,1,comment
t3_1obvfgx,"Don't trust, verify",2025-10-20T22:09:33,r/bitcoin,unthocks,813,post
t1_nkieidm,When I cut my bitcoin in half it ended up being chocolate in the middle! Does anyone know how to contact customer support?,2025-10-20T22:58:16,r/bitcoin,usrname_chex_out,217,comment
t1_nkifs2j,So many believe that BRICS nations will go back to a gold backed currency. I can’t understand why when the same problems would still occur. Where is the gold? Is it real? How much is there? When was the last audit? All these point to BTC being the best asset.,2025-10-20T23:07:14,r/bitcoin,marshmallowlaw,68,comment
t1_nki9zeb,There’s no Bitcoin in there???,2025-10-20T22:22:10,r/bitcoin,negman42,10,comment
t1_nkjfylk,"As much as I like the idea of gold, this is a real fear of mine.",2025-10-21T02:49:43,r/bitcoin,BruceAENZ,7,comment
t1_nkil34e,"A tale as old as time!

But man, that looks like a great chocolate bar.",2025-10-20T23:41:51,r/bitcoin,Sazmining,5,comment
t3_1oajos6,They told me to diversify. I Listened!,2025-10-19T07:41:42,r/bitcoin,Kazgarth_,809,post
t1_nk9xdi3,"My form of diversification:

20% on my Coldcard

20% on my Bitbox

20% on my Jade

20% on my Trezor

20% on my Seedsigner",2025-10-19T08:10:34,r/bitcoin,Mantis-Prawn,53,comment
t1_nk9xms7,"Thats not diversification. You cant just go the m&m color BTC route. Thats not enough in todays cut troat market. In addition to your BTC you also need to get some bitcoin, some satoshis and some sats, preferably all colors aswell. Godspeed.",2025-10-19T08:13:10,r/bitcoin,alsoilikebeer,21,comment
t1_nk9w8bt,don't forget to stack some sats!,2025-10-19T07:59:07,r/bitcoin,zeeshiscanning,8,comment
t1_nk9vu8y,How it feels to DCA.,2025-10-19T07:55:10,r/bitcoin,SaneLad,7,comment
t1_nkaq2zn,Wait... is the black BTC too?,2025-10-19T12:35:43,r/bitcoin,VitoHodl,6,comment
t3_1ollj7o,"Daily Bitcoin meme until BTC is at $200,000 #129",2025-11-01T11:32:11,r/bitcoin,moonlightvle,813,post
t1_nmju9v0,"According to the current sentiment, this guy will be making daily memes for the rest of his life.",2025-11-01T15:58:00,r/bitcoin,riscten,38,comment
t1_nmit0pf,The bro in the second picture clearly doesn't understand what they want from him,2025-11-01T12:15:24,r/bitcoin,thehappycomputer,4,comment
t1_nmkpug7,What if people didn't do either btc or stocks,2025-11-01T18:40:10,r/bitcoin,malibul0ver,2,comment
t1_nn1f7d2,2025 YTD’s: BTC-EUR ~0% world stocks etf ~8%,2025-11-04T10:58:20,r/bitcoin,juolevi,2,comment
t1_nmjzvu3,Hoping !!!,2025-11-01T16:27:22,r/bitcoin,Buffalobella25,1,comment
t3_1oejl8l,"First transaction in 14.3 years Was worth just $67,000 in 2011",2025-10-24T00:18:35,r/bitcoin,LavishlyRitzyy,810,post
t1_nl1y12m,"Got out of prison after 14 years, now living like a king",2025-10-24T00:32:42,r/bitcoin,Argyrus777,290,comment
